{"$schema":"https://json-schema.org/draft/2020-12/schema","$id":"urn:cwl:conceptweave:procedural-model-draft:v0.1.0-draft.1","title":"ConceptWeave procedural model authoring draft","description":"Local unreleased candidate input, not the Noema runtime or a published CWL interchange contract. Shape conformance never establishes graph integrity, authenticated evidence, approval or execution authority.","type":"object","additionalProperties":false,"required":["schema_version","model_id","tenant_ref","task_type","domain_owner_ref","publication_state","truth_status","entry_procedure_id","source_evidence","procedure_nodes","procedure_edges"],"properties":{"schema_version":{"const":"0.1.0-draft.1"},"model_id":{"$ref":"#/$defs/identity_text"},"tenant_ref":{"$ref":"#/$defs/identity_text"},"task_type":{"$ref":"#/$defs/identity_text"},"domain_owner_ref":{"$ref":"#/$defs/identity_text"},"publication_state":{"const":"draft"},"truth_status":{"const":"inferred"},"entry_procedure_id":{"$ref":"#/$defs/identity_text"},"source_evidence":{"$ref":"#/$defs/evidence_list"},"procedure_nodes":{"type":"array","minItems":1,"maxItems":256,"uniqueItems":true,"items":{"$ref":"#/$defs/procedure_node"}},"procedure_edges":{"type":"array","minItems":0,"maxItems":512,"uniqueItems":true,"items":{"$ref":"#/$defs/procedure_edge"}}},"$defs":{"identity_text":{"type":"string","minLength":1,"maxLength":128,"pattern":"^[A-Za-z0-9_][A-Za-z0-9._:/@+=#-]*(?![\\s\\S])"},"annotation_text":{"type":"string","minLength":1,"maxLength":2048,"allOf":[{"pattern":"\\S"},{"pattern":"^[^\\u0000]*$"}]},"sha256_digest":{"type":"string","pattern":"^sha256:[0-9a-f]{64}(?![\\s\\S])"},"locale_annotations":{"type":"object","additionalProperties":false,"required":[],"properties":{"ko":{"$ref":"#/$defs/annotation_text"},"en":{"$ref":"#/$defs/annotation_text"},"ja":{"$ref":"#/$defs/annotation_text"},"zh":{"$ref":"#/$defs/annotation_text"},"vi":{"$ref":"#/$defs/annotation_text"},"es":{"$ref":"#/$defs/annotation_text"},"de":{"$ref":"#/$defs/annotation_text"},"fr":{"$ref":"#/$defs/annotation_text"}},"minProperties":1},"source_reference":{"allOf":[{"$ref":"https://schemas.contextualwisdomlab.org/conceptweave/semantic-candidate/0.1.0#/properties/evidence/items"},{"type":"object","properties":{"source_id":{"$ref":"#/$defs/identity_text"},"source_digest":{"$ref":"#/$defs/sha256_digest"},"location":{"$ref":"#/$defs/annotation_text"}}}]},"evidence_list":{"type":"array","minItems":1,"maxItems":64,"uniqueItems":true,"items":{"$ref":"#/$defs/source_reference"}},"artifact_reference":{"type":"object","additionalProperties":false,"required":["authority_ref","release_ref","artifact_digest","object_ref"],"properties":{"authority_ref":{"$ref":"#/$defs/identity_text"},"release_ref":{"$ref":"#/$defs/identity_text"},"artifact_digest":{"$ref":"#/$defs/sha256_digest"},"object_ref":{"$ref":"#/$defs/identity_text"}}},"procedure_node":{"type":"object","additionalProperties":false,"required":["procedure_id","procedure_kind","locale_labels","source_evidence"],"properties":{"procedure_id":{"$ref":"#/$defs/identity_text"},"procedure_kind":{"enum":["tool_operation","reasoning_step","skill_procedure","task_state"]},"locale_labels":{"$ref":"#/$defs/locale_annotations"},"source_evidence":{"$ref":"#/$defs/evidence_list"},"semantic_refs":{"type":"array","minItems":1,"maxItems":32,"uniqueItems":true,"items":{"$ref":"#/$defs/artifact_reference"}},"tool_contract_ref":{"$ref":"#/$defs/artifact_reference"}},"allOf":[{"if":{"properties":{"procedure_kind":{"const":"tool_operation"}},"required":["procedure_kind"]},"then":{"required":["tool_contract_ref"]}}]},"procedure_edge":{"type":"object","additionalProperties":false,"required":["source_procedure_id","relation_type","target_procedure_id","condition","guidance","pitfalls","source_evidence"],"properties":{"source_procedure_id":{"$ref":"#/$defs/identity_text"},"relation_type":{"enum":["leads_to","requires","enables"]},"target_procedure_id":{"$ref":"#/$defs/identity_text"},"condition":{"$ref":"#/$defs/locale_annotations"},"guidance":{"$ref":"#/$defs/locale_annotations"},"pitfalls":{"$ref":"#/$defs/locale_annotations"},"source_evidence":{"$ref":"#/$defs/evidence_list"}}}}}
