{"schema_version":"0.1.0-draft.1","model_id":"review_procedure_model","tenant_ref":"unit_fixture_tenant","task_type":"review_repair","domain_owner_ref":"ContextualWisdomLab/.github","publication_state":"draft","truth_status":"inferred","entry_procedure_id":"read_review","source_evidence":[{"source_id":"unit_fixture_review_sop","source_digest":"sha256:1111111111111111111111111111111111111111111111111111111111111111","location":"section_2/step_1"}],"procedure_nodes":[{"procedure_id":"read_review","procedure_kind":"reasoning_step","locale_labels":{"ko":"리뷰 근거 읽기","en":"Read review evidence"},"source_evidence":[{"source_id":"unit_fixture_review_sop","source_digest":"sha256:1111111111111111111111111111111111111111111111111111111111111111","location":"section_2/step_1"}]},{"procedure_id":"verify_finding","procedure_kind":"tool_operation","locale_labels":{"ko":"지적 사항 검증","en":"Verify the finding"},"source_evidence":[{"source_id":"unit_fixture_review_sop","source_digest":"sha256:1111111111111111111111111111111111111111111111111111111111111111","location":"section_2/step_1"}],"tool_contract_ref":{"authority_ref":"ContextualWisdomLab/noema","release_ref":"unit_fixture_release","artifact_digest":"sha256:2222222222222222222222222222222222222222222222222222222222222222","object_ref":"verify_evidence"}}],"procedure_edges":[{"source_procedure_id":"read_review","relation_type":"leads_to","target_procedure_id":"verify_finding","condition":{"ko":"검토할 근거가 있습니다.","en":"Evidence is available for review."},"guidance":{"ko":"현재 수정본에서 지적 사항을 재현합니다.","en":"Reproduce the finding against the current revision."},"pitfalls":{"ko":"이전 수정본의 통과 기록을 승인 근거로 사용하지 않습니다.","en":"Do not treat an older revision result as approval."},"source_evidence":[{"source_id":"unit_fixture_review_sop","source_digest":"sha256:1111111111111111111111111111111111111111111111111111111111111111","location":"section_2/step_1"}]}]}
